{
  "background_image_url": "/Users/cc/Desktop/photo_show/phase0_results/output_gamestick_test/gamestick_bg_1776413466517.jpg",
  "hero_number": "4K",
  "brand_name": "EXCITAT",
  "brand_color": "#E11111",
  "badge_text": "128GB",
  "badge_color": "#1E88E5",
  "spec_line_1": "31999+ Games",
  "spec_line_2": "23 Emulators",
  "canvas_size": 1024
}