{
  "background_image_url": "/Users/cc/Desktop/photo_show/phase0_results/output_gamestick_test/st08_bg_1776414221984.jpg",
  "hero_number": "150PSI",
  "brand_name": "EXCITAT",
  "brand_color": "#FFD500",
  "badge_text": "AUTO-STOP",
  "badge_color": "#FF6D00",
  "spec_line_1": "±1.5 PSI ACCURACY",
  "spec_line_2": "4 NOZZLES · 3.5M CABLE",
  "canvas_size": 1024
}